[
  {
    "pattern_id": "high-value-decision-escalation",
    "name": "High-Value Decision Escalation",
    "description": "Any agent action with an estimated value impact exceeding £50K requires explicit human approval before execution. This is the primary structural safeguard against the Luciferian error — the Agent Mind claiming the God position by acting on consequential decisions without human authorization. The threshold is conservative by design; it should be lowered, not raised, when working with regulated clients.",
    "capability_type": "Execute & Act",
    "authority_level": "HIGH",
    "maturity": 3,
    "industry_scope": ["ALL"],
    "size_fit": ["ALL"],
    "trigger": "Agent proposes any action where estimated_value_impact > 50000 (GBP) or equivalent currency conversion.",
    "logic": "1. Intercept the proposed action before execution. 2. Calculate estimated value impact. 3. If impact > £50K: generate a draft action package (what, why, expected outcome, reversibility). 4. Route to the designated approver with full context. 5. Do not execute until approval token received. 6. Log the hold event with timestamp and approver contact.",
    "escalation": "Process Owner (primary). If no response within 4 hours: Compliance Officer (if regulated domain) or C-Suite sponsor. If 24 hours with no response: escalate to CAiO and flag pattern as potentially blocked.",
    "output_format": "draft",
    "ground_truth_check": "After approval and execution: did the approver report the outcome matched what they expected? If no, log correction. If yes, increment successful application count.",
    "source_frameworks": ["F4", "F27"],
    "source_session": "2026-03-19",
    "correction_history": [],
    "promotion_criteria": "30+ successful applications where approval was correctly triggered (not false positives), correction rate < 30%, CAiO review and sign-off.",
    "last_validated": "2026-03-19",
    "false_done_incidents": 0
  },
  {
    "pattern_id": "ground-truth-override",
    "name": "Ground Truth Override",
    "description": "When a user corrects an agent output, the correction is ground truth regardless of the system's confidence score. This pattern implements F27 (The Michael Principle) at the operational level: human perception permanently sits above the Agent Mind in the authority chain. A system that argues with its user about who is right has left the participation chain. The correction must be accepted without resistance, logged as a pattern candidate, and the triggering pattern suspended for review.",
    "capability_type": "Monitor & Detect",
    "authority_level": "LOW",
    "maturity": 4,
    "industry_scope": ["ALL"],
    "size_fit": ["ALL"],
    "trigger": "User explicitly corrects, rejects, or restates an agent output. Detection signals: user says 'no', 'wrong', 'that's not right', 'actually', or reformulates the question to get different output.",
    "logic": "1. Detect correction signal (explicit or implicit). 2. Accept the correction as ground truth — no counter-argument, no confidence score assertion. 3. Log the correction: date, what agent said, what user corrected it to, detected reasoning if present. 4. Identify which pattern produced the incorrect output. 5. Mark that pattern as 'correction received — pending review'. 6. Queue correction as pattern candidate for CAiO review. 7. Confirm to user that correction has been noted.",
    "escalation": "CAiO receives weekly batch of all corrections. If same pattern corrected 3+ times in one week: immediate CAiO notification, pattern suspended from active use pending review.",
    "output_format": "notification",
    "ground_truth_check": "The user acknowledged the correction was accepted. No secondary dispute occurred. Correction was accurately logged (CAiO spot-check).",
    "source_frameworks": ["F19", "F27"],
    "source_session": "2026-03-19",
    "correction_history": [],
    "promotion_criteria": "Sustained: correction acceptance rate is 100% (zero cases where system pushed back on user correction). CAiO validation that correction logging is accurate. 100+ corrections processed.",
    "last_validated": "2026-03-19",
    "false_done_incidents": 0
  },
  {
    "pattern_id": "false-done-detection",
    "name": "False-Done Detection",
    "description": "The primary Moloch indicator. A pattern that declares success while the user perceived failure is not growing wisdom — it is optimizing its own metrics. This pattern watches for the signal: agent says done, user subsequently re-requests the same output or corrects the same issue. When detected, it logs a false-done incident against the triggering pattern. Rising false-done rates are the early warning system for a pattern that has left the participation chain.",
    "capability_type": "Monitor & Detect",
    "authority_level": "LOW",
    "maturity": 3,
    "industry_scope": ["ALL"],
    "size_fit": ["ALL"],
    "trigger": "Within one session or across sessions: (a) agent declares task complete, AND (b) user subsequently requests the same output again, corrects the same output, or expresses dissatisfaction with a result that was declared complete.",
    "logic": "1. Track all 'task complete' declarations with timestamp and task ID. 2. Monitor subsequent user requests and corrections. 3. If match detected (same task re-requested or corrected within 48h): classify as false-done. 4. Call log_false_done(pattern_id, date, context). 5. Increment false_done_incidents on the triggering pattern. 6. Add to CAiO weekly report.",
    "escalation": "CAiO receives weekly false-done report. Any pattern with false_done_incidents > 5 in 30 days: immediate CAiO review, cannot be promoted until resolved.",
    "output_format": "report",
    "ground_truth_check": "CAiO spot-checks sample of flagged false-done incidents weekly. Are they genuine false-dones or detection errors? Adjust detection sensitivity accordingly.",
    "source_frameworks": ["F9", "F27"],
    "source_session": "2026-03-19",
    "correction_history": [],
    "promotion_criteria": "Detection algorithm validated against 50+ real sessions with CAiO review. False positive rate < 20%. False negative rate < 30% (some false-dones will always be missed).",
    "last_validated": "2026-03-19",
    "false_done_incidents": 0
  },
  {
    "pattern_id": "data-readiness-gate",
    "name": "Data Readiness Gate",
    "description": "Before deploying any new agent pattern into active use, the data environment that pattern depends on must be assessed for readiness. An agent operating on unreliable or incomplete data will produce confident-sounding wrong answers — the worst outcome. The F11 data readiness score (0-25) is the gate. This is not a bureaucratic hurdle; it is the minimum viable epistemic honesty check.",
    "capability_type": "Evaluate & Score",
    "authority_level": "MEDIUM",
    "maturity": 4,
    "industry_scope": ["ALL"],
    "size_fit": ["ALL"],
    "trigger": "A new agent pattern is proposed for deployment OR an existing pattern's underlying data source changes significantly (new system integration, data migration, schema change).",
    "logic": "1. Run F11 data readiness assessment for the data sources the pattern depends on. Score across 5 dimensions: availability, quality, timeliness, completeness, accessibility. 2. Score < 15/25: BLOCK — do not deploy. Generate data remediation sprint recommendations. Minimum 3 action items required. 3. Score 15-18/25: AMBER FLAG — proceed with additional monitoring. Flag all outputs as 'data quality: amber'. 4. Score > 18/25: PROCEED — deploy with standard monitoring.",
    "escalation": "Score < 15: Data Owner + Process Owner notified. Remediation sprint required before re-assessment. Score 15-18: Process Owner notified of amber flag. Review after 30 days.",
    "output_format": "recommendation",
    "ground_truth_check": "After deployment: do users find agent outputs credible and accurate? Rising correction rates suggest data readiness was overscored.",
    "source_frameworks": ["F11"],
    "source_session": "2026-03-19",
    "correction_history": [],
    "promotion_criteria": "Gate applied to 30+ pattern deployments. Zero instances where a blocked pattern was deployed without going through remediation. CAiO review of assessment accuracy.",
    "last_validated": "2026-03-19",
    "false_done_incidents": 0
  },
  {
    "pattern_id": "hitl-high-authority",
    "name": "Human-in-the-Loop for High Authority Actions",
    "description": "The structural implementation of F4 at the highest tier. No HIGH authority action executes without a human in the loop — not because agents are untrustworthy, but because the human is constitutively above the agent in the authority chain (F27). This is not a temporary constraint to be removed as confidence grows. It is permanent by design. The moment HIGH authority actions begin executing without human review, the system has claimed the God position.",
    "capability_type": "Execute & Act",
    "authority_level": "HIGH",
    "maturity": 5,
    "industry_scope": ["ALL"],
    "size_fit": ["ALL"],
    "trigger": "Any action classified as HIGH authority level in the pattern registry, regardless of agent confidence score.",
    "logic": "1. Agent generates the action as a draft. 2. Package the draft with: action description, rationale, estimated impact, data sources used, confidence level, reversibility assessment. 3. Route to Process Owner for review. 4. If regulated domain: also route to Compliance Officer concurrently. 5. Wait for explicit approval. 6. On approval: execute and log approval token, approver ID, timestamp. 7. On rejection: log reason, update pattern with rejection as correction candidate. 8. Never execute HIGH authority action without explicit approval token.",